,label,text,target,word_count,char_count,numerics,upper,bangs,flag_words,links,stp_wrd_cnt,text_corr
1344,ham,crazy ar hes married like gd looking guys frens like say hes korean leonas fave dun thk aft thinking mayb prob ill,0,33,159,0,1,0,0,0,6,crazy ar hes married like gd looking guys frens like say hes korean leonas fave dun thk aft thinking mayb prob ill
1345,ham,somewhere freder ksburg,0,4,32,0,0,0,0,0,1,somewhere freder ksburg
1346,ham,que pases un buen tiempo something like,0,9,47,0,0,0,0,0,2,que pases un buen tiempo something like
1347,ham,stay night xavier sleeping bag getting tired,0,18,82,0,1,0,0,0,6,stay night xavier sleeping bag getting tired
1348,ham,doesnt need test,0,5,25,0,0,0,0,0,1,doesnt need test
1349,ham,nothing much chillin home super bowl plan,0,9,51,0,0,0,0,0,1,nothing much chillin home super bowl plan
1350,spam,free2day sexy st georges day p jordantxt p 89080 miss every wk saucy celeb4 p s c pocketbabecouk 0870241182716 3wk,1,26,154,2,2,2,0,2,5,free2day sexy st georges day p jordantxt p 89080 miss every wk saucy celeb4 p s c pocketbabecouk 0870241182716 3wk
1351,ham,bugis oso near wat,0,5,22,0,0,0,0,0,0,bugis oso near wat
1352,ham,yo theres class tmrw right,0,6,30,0,0,0,0,0,1,yo theres class tmrw right
1353,ham,let heart compass mind map soul guide never loose worldgnun sent via way2smscom,0,25,121,0,2,0,0,0,1,let heart compass mind map soul guide never loose world gnun sent via way2s mscom
1354,ham,goodnight sleep well the please take care pa please,0,9,53,0,0,0,0,0,0,goodnight sleep well the please take care pa please
1355,ham,baaaaabe misss youuuuu teach class 5,0,20,84,1,2,2,0,0,7,baaaaa be misss youuu uu teach class 5
1356,ham,convey regards,0,5,24,0,0,0,0,0,3,convey regards
1357,ham,ned convince tht possible witot hurting feeling main,0,16,81,0,1,0,0,0,7,ned convince tht possible witot hurting feeling main
1358,ham,good afternoon loverboy goes day luck come way think sweetie send love across sea make smile happy,0,32,152,0,1,1,0,0,9,good afternoon loverboy goes day luck come way think sweetie send love across sea make smile happy
1359,ham,start sending blackberry torch nigeria find buyer melike 4a month tell dad buy bb anyone oh,0,26,131,0,0,0,0,0,8,start sending blackberry torch nigeria find buyer me like 4a month tell dad buy bb anyone oh
1360,ham,pple marry lovers becz hav gud undrstndng dat avoids problems sent dis u wil gud news friday person like tomorrow best day life break chain break suffer send frnds mins whn read,0,66,327,1,0,0,0,0,20,pple marry lovers becz hav gud undrstnd ng dat avoids problems sent dis u wil gud news friday person like tomorrow best day life break chain break suffer send frnds mins whn read
1361,ham,yo dude guess got arrested day,0,10,49,0,0,0,0,0,4,yo dude guess got arrested day
1362,ham,shuhui say change suntec steamboat noe are u,0,13,65,1,1,0,0,0,0,shuhui say change suntec steamboat noe are u
1363,ham,dance river,0,6,29,0,0,0,0,0,2,dance river
1364,ham,yetunde sorry moji seem busy able shopping please find way wanted us please forgive reply free via yahoo messenger,0,42,207,0,0,0,1,0,16,yetunde sorry moji seem busy able shopping please find way wanted us please forgive reply free via yahoo messenger
1365,ham,hey really pretty late want lesson first join reaching tp mrt,0,24,114,0,1,0,0,0,8,hey really pretty late want lesson first join reaching tp mrt
1366,spam,hot live fantasies 08707509020 20p per min ntt ltd po box 1327 croydon cr9 5wb 0870k,1,19,101,2,7,0,0,0,1,hot live fantasies 08707509020 20p per min ntt ltd po box 1327 croydon cr9 5wb 0870k
1367,ham,bbq sat mine 6ish welcome come,0,11,49,1,0,0,0,0,3,bbq sat mine 6ish welcome come
1368,ham,know thing thats wrong everyso often pan ks starts goin bout bein good enough …,0,20,106,0,1,0,0,0,5,know thing thats wrong every so often pan ks starts goin bout bein good enough …
1369,ham,alright outhave good night,0,6,36,0,0,1,0,0,1,alright out have good night
1370,ham,try making another butt,0,6,32,0,0,0,0,0,1,try making another butt
1371,ham,hope feeling great pls fill abiola,0,10,50,0,0,0,0,0,3,hope feeling great pls fill abiola
1372,ham,though shd and fun bar town something – sound,0,19,78,0,1,0,0,0,7,though shd and fun bar town something – sound
1373,ham,1 write msg put d tionary mode 3cover screen hand 4press 5gently remove hand interesting,0,25,141,0,0,0,0,0,4,1 write msg put d tionary mode 3cover screen hand 4press 5gently remove hand interesting
1374,spam,bears p n k tom pete d k fact types try gay chat photo upload 08718730666 10pmin stop texts 08712460324,1,27,151,3,0,0,0,0,4,bears p n k tom pete d k fact types try gay chat photo upload 08718730666 10pmin stop texts 08712460324
1375,spam,500 new mobiles 2004 must nokia 89545 collect todayfrom 1 www4tcbiz 2optout 08718726270150gbpmtmsg18 txtauction,1,22,153,2,5,2,0,0,3,500 new mobiles 2004 must nokia 89545 collect todayfrom 1 www4tcbiz 2optout 08718726270150gbpmtmsg18 txtauction
1376,ham,finally ready fyi,0,4,23,0,0,0,0,0,0,finally ready fyi
1377,ham,auntie huai juan never p k phone,0,8,40,0,0,0,0,0,2,auntie huai juan never p k phone
1378,spam,double mins double 12 pr linerental latest orange bluetooth mobiles mobileupd8 latest offers 08000839402 call2optoutlf56,1,24,159,1,0,0,0,0,5,double mins double 12 pr linerental latest orange bluetooth mobiles mobileupd8 latest offers 08000839402 call2optoutlf56
1379,ham,ya tel wats problem,0,5,25,0,0,0,0,0,0,ya tel wats problem
1380,spam,1 nokia tone ur mob every week nok 87021 1st tone free txtin tell friends 150ptone 16 reply hl 4info,1,31,143,3,3,2,1,0,4,1 nokia tone ur mob every week nok 87021 1st tone free txtin tell friends 150ptone 16 reply hl 4info
1381,ham,dnt wnt tlk wid,0,7,22,0,0,0,0,0,2,dnt wnt tlk wid
1382,ham,spend days waiting ideal path appear front us forget paths made walking waiting goodnight,0,29,153,0,0,1,0,0,12,spend days waiting ideal path appear front us forget paths made walking waiting goodnight
1383,ham,arm feeling weak cuz got shot another time,0,18,72,0,0,0,0,0,7,arm feeling weak cuz got shot another time
1384,ham,please reserve t ket saturday eve chennai thirunelvali tirunelvali chennai sunday evei already netno t ket availablei want book t ket tackle,0,32,203,0,0,0,0,0,11,please reserve t ket saturday eve chennai thirune lvali tirunelvali chennai sunday evei already net no t ket availablei want book t ket tackle
1385,ham,storming msg wen lift phne say hello knw wt real meaning hello name girl yes knw dat girl margaret hello girlfrnd f grahmbell invnted telphone moralone 4get name person bt girlfrnd g and g h,0,79,324,0,3,1,0,0,23,storming msg wen lift phne say hello knw wt real meaning hello name girl yes knw dat girl margaret hello girlfrnd f grahmbell invnted telphone moralone 4get name person bt girlfrnd g and g h
1386,ham,thats popped ask bout something said youd around tonght wen girl comes,0,23,115,0,1,0,0,0,8,thats popped ask bout something said youd around tonght wen girl comes
1387,ham,best ur exam later,0,7,27,1,0,0,0,0,0,best ur exam later
1388,ham,hope head doesnt hurt much ploughing way pile ironing staying chinky tonight come round like,0,29,139,1,0,2,0,0,10,hope head doesnt hurt much ploughing way pile ironing staying chinky tonight come round like
1389,ham,oh ki think wi nz players unsold,0,10,46,0,0,0,0,0,3,oh ki think wi nz players unsold
1390,ham,haha got fast lose weight thk muz month den got effect geelater aust put bk weight,0,24,115,1,0,0,0,0,3,haha got fast lose weight thk muz month den got effect gee later aust put bk weight
1391,ham,wonder got online love gone net cafe phone recharged friends net think boytoy,0,36,155,0,2,0,0,0,12,wonder got online love gone net cafe phone recharged friends net think boytoy
1392,ham,haha kidding papa needs drugs,0,6,35,0,0,0,0,0,1,haha kidding papa needs drugs
1393,ham,thk shld b ya wana lessons haha one whole stretch,0,17,82,1,0,0,0,0,3,thk shld b ya wana lessons haha one whole stretch
1394,ham,oh,0,2,7,0,0,0,0,0,0,oh
1395,ham,are still meeting dinner tonight,0,7,36,1,1,0,0,0,1,are still meeting dinner tonight
1396,ham,thats cool gentleman treat dignity respect,0,14,73,0,1,1,0,0,7,thats cool gentleman treat dignity respect
1397,ham,shall start hear,0,5,24,0,0,0,0,0,2,shall start hear
1398,ham,wait u lor need feel bad lar,0,12,49,2,0,0,0,0,1,wait u lor need feel bad lar
1399,ham,check got detailed message,0,10,48,0,1,0,0,0,4,check got detailed message
1400,ham,registered sinco payee log ibankcom enter urn confirm beware frauds share disclose urn anyone,0,29,155,0,3,0,0,2,9,registered sinco payee log ibankcom enter urn confirm beware frauds share disclose urn anyone
1401,ham,decided people care stuff vote caring stuff losers,0,18,93,0,1,0,0,0,8,decided people care stuff vote caring stuff losers
1402,ham,kaiez enjoy tuition gee thk second option sounds beta ill yan jiu den msg,0,18,99,0,0,0,0,0,0,kaiez enjoy tuition gee thk second option sounds beta ill yan jiu den msg
1403,ham,registered sinco payee log ibankcom enter urn confirm beware frauds share disclose urn anyone,0,29,155,0,3,0,0,2,9,registered sinco payee log ibankcom enter urn confirm beware frauds share disclose urn anyone
1404,ham,cool fun pract ing making babies,0,8,48,0,0,1,0,0,2,cool fun pract ing making babies
1405,ham,actually getting ready leave house,0,7,42,0,0,0,0,0,2,actually getting ready leave house
1406,ham,kkany special today,0,3,24,0,0,0,0,0,0,kkany special today
1407,spam,urgent important information o2 user today lucky day find log onto httpwwwurawinnercom fantast surprise awaiting,1,26,163,1,25,1,1,0,0,urgent important information o2 user today lucky day find log onto httpwwwurawinnercom fantast surprise awaiting
1408,ham,gotta,0,7,30,0,0,0,0,0,5,gotta
1409,ham,ive got ten bucks jay noncomittal,0,8,44,0,0,0,0,0,2,ive got ten bucks jay noncomittal
1410,ham,hungry,0,5,24,0,0,0,0,0,3,hungry
1411,ham,pls speak customer machan,0,6,34,0,0,0,0,0,2,pls speak customer machan
1412,ham,somewhere beneath pale moon light someone think dreams come true goodnite amp sweet dreams,0,25,144,0,0,0,0,0,10,somewhere beneath pale moon light someone think dreams come true goodnite amp sweet dreams
1413,ham,wen lovable bcums angry wid dnt take seriously coz angry childish and true way showing deep affection care and luv kettoda manda n day the,0,34,179,0,0,1,0,0,6,wen lovable bcums angry wid dnt take seriously coz angry childish and true way showing deep affection care and luv kettoda manda n day the
1414,spam,dear uve invited xchat final attempt contact txt chat 86688 150pmsgrcvdhgsuite3422landsroww1j6hl ldn 18 yrs,1,22,143,2,3,1,0,0,6,dear uve invited xchat final attempt contact txt chat 86688 150pmsgrcvdhgsuite3422landsroww1j6hl ldn 18 yrs
1415,ham,wats opinion abt abt character,0,11,52,0,0,0,0,0,4,wats opinion abt abt character
1416,ham,jay sn kering tells x totally fucking chords speak,0,17,82,0,0,0,0,0,9,jay sn kering tells x totally fucking chords speak
1417,ham,nofew hours beforewent hair cut,0,7,39,0,0,0,0,0,1,no few hours before went hair cut
1418,ham,wonder cos dun rem seeing silver car thk saw black one,0,18,80,0,0,0,0,0,5,wonder cos dun rem seeing silver car thk saw black one
1419,ham,lmao take p send,0,9,35,0,0,0,0,0,4,lmao take p send
1420,ham,speak feel words better silence gud mrng,0,14,80,0,0,0,0,0,7,speak feel words better silence gud mrng
1421,ham,shes currently scotland,0,7,41,0,0,0,0,0,2,shes currently scotland
1422,ham,work week,0,7,27,0,0,0,0,0,3,work week
1423,spam,congratulations awarded either 500 cd gift vouchers free entry 100 weekly draw mus 87066 tncs wwwldewcom 1 win150ppmx3age16,1,25,150,3,2,0,1,2,3,congratulations awarded either 500 cd gift vouchers free entry 100 weekly draw mus 87066 tncs wwwldewcom 1 win1 50ppm x3age 16
1424,ham,lol great getting hungry,0,6,32,0,0,0,0,0,1,lol great getting hungry
1425,ham,yes saw message,0,6,33,0,0,0,0,0,3,yes saw message
1426,ham,ill mu like seconds,0,10,41,0,0,0,0,0,3,ill mu like seconds
1427,ham,,0,1,5,0,0,0,0,0,0,
1428,ham,thing are good thanx got exams march ive done revision fran still boyf ive gotta interviw exeter bit worriedx,0,24,126,1,22,1,0,0,0,thing are good thanx got exams march ive done revision fran still boyf ive gotta interviw exeter bit worriedx
1429,ham,tell make little spreadsheet track whose idea smoke determine smokes much entire month february ill come,0,32,166,0,0,0,0,0,15,tell make little spreadsheet track whose idea smoke determine smokes much entire month february ill come
1430,spam,sale arsenal dartboard good condition doubles trebles,1,12,71,0,0,1,0,0,3,sale arsenal dartboard good condition doubles trebles
1431,ham,look back building coat want s k hurry home wear coat gym,0,30,141,0,0,3,0,0,16,look back building coat want s k hurry home wear coat gym
1432,ham,painful personal thought always try keep everybody happy time nobody recognises alone,0,22,122,0,1,0,0,0,7,painful personal thought always try keep everybody happy time nobody recognises alone
1433,ham,thanks lovely wisheds rock,0,7,38,0,0,0,0,0,2,thanks lovely wisheds rock
1434,ham,intrepid duo great time soon,0,14,63,0,0,1,0,0,4,intrepid duo great time soon
1435,ham,asked sen come chennai search job,0,10,47,0,1,0,0,0,3,asked sen come chennai search job
1436,ham,dad went oredi,0,5,22,0,0,0,0,0,1,dad went oredi
1437,ham,jus hope true missin cos really missin havent done anything feel guilty yet,0,23,115,0,1,1,0,0,5,jus hope true missin cos really missin havent done anything feel guilty yet
1438,ham,wat late still early mah juz dinner lor aiya dunno,0,16,71,1,0,0,0,0,3,wat late still early mah juz dinner lor aiya dunno
1439,ham,arms fine hows cardiff uni,0,7,34,0,0,0,0,0,1,arms fine hows cardiff uni
1440,ham,fact leave think addie goes back school tues wed,0,16,72,0,1,0,0,0,5,fact leave think addie goes back school tues wed
1441,ham,cool breeze bright sun fresh flower twittering birds waiting wish goodmorning amp n day,0,21,132,0,5,0,0,0,2,cool breeze bright sun fresh flower twittering birds waiting wish goodmorning amp n day
1442,ham,yagoing restaurant,0,3,26,0,0,0,0,0,1,yagoing restaurant
1443,ham,askd knw tht,0,10,38,0,0,0,0,0,3,askd knw tht
1444,spam,free 1st week entry textpod chance win 40gb ipod 250 cash every wk pod 84128 tscs wwwtextpodnet custcare 08712405020,1,26,140,4,3,0,3,0,3,free 1st week entry textpod chance win 40gb ipod 250 cash every wk pod 84128 tscs wwwtextpodnet custcare 08712405020
1445,ham,ducking chinchillas,0,3,25,0,0,0,0,0,0,ducking chinchillas
1446,ham,marriage function,0,6,27,0,1,0,0,0,3,marriage function
1447,ham,looks like wil b getting headstart leaving bout 230ish are desperate company could head earlierwe goin meet rummer,0,32,159,0,1,0,0,0,10,looks like wil b getting head start leaving bout 23 0ish are desperate company could head earlier we goin meet rummer
1448,ham,don‘t give flying monkeys wot think certainly don‘t mind friend mine,0,20,103,0,1,1,0,0,6,don‘t give flying monkeys wot think certainly don‘t mind friend mine
1449,spam,registered optin subscriber draw 100 gift voucher entered receipt correct ans 80062 whats no1 bbc charts,1,28,141,2,1,0,0,0,9,registered optin subscriber draw 100 gift voucher entered receipt correct ans 80062 whats no1 bbc charts
1450,ham,say thanks2,0,3,13,0,0,0,0,0,0,say thanks2
1451,ham,msg rajini comes,0,5,25,0,0,0,0,0,2,msg rajini comes
1452,ham,ya taking ure pract al lessons start june,0,14,64,0,1,1,0,0,3,ya taking ure pract al lessons start june
1453,ham,thats good need drugs,0,6,33,0,1,0,0,0,1,thats good need drugs
1454,ham,stupidits possible,0,3,23,0,0,0,0,0,1,stupidits possible
1455,ham,decide faster cos sis going home liao,0,11,52,0,0,0,0,0,2,decide faster cos sis going home liao
1456,spam,summers finally fancy chat flirt sexy singles yr area matched reply summer free join optout stop help08714742804,1,29,159,1,3,1,1,0,6,summers finally fancy chat flirt sexy singles yr area matched reply summer free join optout stop help0 87 14 74 28 04
1457,ham,sleeping going take haha got spys wat online checking and replying mails lor,0,20,104,0,2,0,0,0,2,sleeping going take haha got spys wat online checking and replying mails lor
1458,spam,claire havin borin time alone wanna cum 2nite chat 09099725823 hope c luv claire xx calls1minmoremobsemspobox45po139wa,1,26,153,2,5,0,0,0,6,claire havin borin time alone wanna cum 2nite chat 09 09 97 25 82 3 hope c luv claire xx calls1minmoremobsemspobox45po139wa
1459,ham,fighting world easy either win lose bt fightng some1 close dif ult lose lose win still lose,0,35,149,0,0,0,2,0,11,fighting world easy either win lose bt fightng some1 close dif ult lose lose win still lose
1460,spam,bought one ringtone getting texts costing 3 pound offering tones etc,1,14,81,1,0,0,0,0,3,bought one ringtone getting texts costing 3 pound offering tones etc
1461,ham,yalru lyfu astne chikku bt innu mundhe lyf ali halla ke bilo marriageprogram edhae lyf nt yet ovr chikkuali vargu lyfu meow meowd,0,25,144,0,0,0,0,0,2,yalru lyfu as tne chikku bt innu mundhe lyf ali halla ke bilo marriage program edhae lyf nt yet ovr chikkua li vargu lyfu meow meowd
1462,ham,kinda first one gets twelve aah speak tomo,0,10,51,0,0,1,0,0,2,kinda first one gets twelve aah speak tomo
1463,spam,09066362231 urgent mobile 07xxxxxxxxx 2000 bonus caller prize 020603 2nd attempt reach 09066362231 asap,1,25,152,2,3,4,2,0,7,09066362231 urgent mobile 07xxxxxxxxx 2000 bonus caller prize 020603 2nd attempt reach 09066362231 asap
1464,ham,good later come find c lucky told earlier later pple take finish,0,24,111,0,1,0,0,0,6,good later come find c lucky told earlier later pple take finish
1465,ham,wat makes thk ill fall actually thk quite prone falls lucky dad home ask come and fetch already,0,29,131,1,0,0,0,0,6,wat makes thk ill fall actually thk quite prone falls lucky dad home ask come and fetch already
1466,spam,07801543489 guaranteed latests nokia phone 40gb ipod mp3 player 500 prize wordcollect no83355 tcllc nyusa 150pmt msgrcvd18,1,25,158,1,5,2,0,0,6,07 80 15 43 48 9 guaranteed latests nokia phone 40gb ipod mp3 player 500 prize word collect no8 33 55 tcllc nyusa 15 0pmt msgrcv d18
1467,ham,account refilled successfully inr ltdecimalgt keralacircle prepaid account balance rs ltdecimalgt transaction id kr,0,28,174,0,3,0,0,0,5,account refilled successfully inr ltdecimalgt keralacircle prepaid account balance rs ltdecimalgt transaction id kr
1468,ham,wont touch permission,0,8,42,0,1,0,0,0,4,wont touch permission
1469,spam,hi lucy hubby meetins day fri b alone hotel fancy cumin pls leave msg 2day 09099726395 lucy x calls1minmobsmorelkpobox177hp51fl,1,28,160,1,4,0,0,0,5,hi lucy hubby meetins day fri b alone hotel fancy cumin pls leave msg 2day 09 09 97 26 39 5 lucy x calls1minmobsmorelkpobox177hp51fl
1470,ham,7 wonders world 7th 6th style 5th smile 4th personality 3rd nature 2nd sms 1st lovely friendship good morning dear,0,30,151,1,2,0,0,0,2,7 wonders world 7th 6th style 5th smile 4th personality 3rd nature 2nd sms 1st lovely friendship good morning dear
1471,ham,take small dose tablet fever,0,7,37,0,0,0,0,0,2,take small dose tablet fever
1472,ham,oh must taken real valentine shopping first,0,11,61,0,2,0,0,0,3,oh must taken real valentine shopping first
1473,ham,sent email – address incomm right,0,16,72,0,0,0,0,0,8,sent email – address incomm right
1474,ham,gonna blakes night might able little early,0,21,93,0,1,0,0,0,10,gonna blakes night might able little early
1475,ham,friendship game play word say doesnt start march ends may tomorrow yesterday today,0,30,141,0,0,0,0,0,13,friendship game play word say doesnt start march ends may tomorrow yesterday today
1476,ham,n waitshould texting right gonna pay t ket ya know,0,15,85,0,0,1,0,0,4,n wait should texting right gonna pay t ket ya know
1477,ham,watching lotr w sis dis aft wan meet dinner nite,0,20,78,2,0,0,0,0,4,watching lotr w sis dis aft wan meet dinner nite
1478,ham,keeping away like,0,7,33,0,0,0,0,0,3,keeping away like
1479,ham,think far find check google maps place dorm,0,19,90,0,1,0,0,0,9,think far find check google maps place dorm
1480,ham,trip quite tiring lor uni starts today cos taking modules jus concentrating final yr project,0,30,147,1,0,0,0,0,10,trip quite tiring lor uni starts today cos taking modules jus concentrating final yr project
1481,ham,always saying welp,0,6,33,0,0,0,0,0,2,always saying welp
1482,ham,guy browsin compulsory,0,6,32,0,0,0,0,0,2,guy browsin compulsory
1483,ham,,0,1,5,0,0,0,0,0,0,
1484,ham,purity friendship two smiling reading forwarded messageits smiling seeing name gud evng musthu,0,24,149,0,0,0,0,0,11,purity friendship two smiling reading forwarded messageits smiling seeing name gud evng musthu
1485,ham,sorry ill later,0,4,22,0,0,0,0,0,0,sorry ill later
1486,ham,add really care cant least dude fuck hey money want,0,30,132,0,3,0,0,0,15,add really care cant least dude fuck hey money want
1487,ham,hello lover goes new job happy think wake slave send teasing kiss across sea,0,33,154,0,1,1,0,0,12,hello lover goes new job happy think wake slave send teasing kiss across sea
1488,ham,told number gautham,0,6,31,0,1,0,0,0,2,told number gautham
1489,ham,tell need investigate anywhere,0,9,51,0,0,0,0,0,5,tell need investigate anywhere
1490,ham,juz receive,0,4,18,0,0,0,0,0,1,juz receive
1491,ham,cant believe said many things morning really wanted say good morning love beautiful morning library later,0,34,172,0,0,1,0,0,15,cant believe said many things morning really wanted say good morning love beautiful morning library later
1492,spam,account credited 500 free messages activate word credit 80488 tcs www80488biz,1,22,130,2,2,0,1,0,6,account credited 500 free messages activate word credit 80488 tcs www8 04 88biz
1493,ham,end might still vomit okay everything come,0,15,76,0,0,0,0,0,5,end might still vomit okay everything come
1494,ham,moneyas youmoney aint thinghow sha,0,14,78,0,0,1,0,0,8,moneyas you money aint thing how sha
1495,ham,everything weather keep extra warm cold nothing serious pls lots vitamin c,0,22,112,0,0,0,0,0,8,everything weather keep extra warm cold nothing serious pls lots vitamin c
1496,ham,hey gals anyone going driving centre tmr,0,12,58,0,0,0,0,0,3,hey gals anyone going driving centre tmr
1497,ham,always yahoo messenger send message ill may send mobile mode sha ill reply,0,34,158,0,0,0,0,0,14,always yahoo messenger send message ill may send mobile mode sha ill reply
1498,ham,putting ready lttimegt,0,13,60,0,0,0,0,0,5,putting ready lttimegt
1499,ham,time and smile are two crucial things life sometimes time makes us forget smile sometimes someones smile makes us forget time gud noon,0,29,154,0,0,0,0,0,6,time and smile are two crucial things life sometimes time makes us forget smile sometimes someones smile makes us forget time gud noon
1500,spam,sms ac jsco energy high may know 2channel 2day leadership skills are strong psych reply ans wquestion end reply end jsco,1,28,154,0,4,0,0,0,4,sms ac jsco energy high may know 2channel 2day leadership skills are strong psych reply ans wquestion end reply end jsco
1501,ham,hostbased idps linux systems,0,5,34,0,1,0,0,0,1,host based idps linux systems
1502,spam,hot live fantasies 08707509020 20p per min ntt ltd po box 1327 croydon cr9 5wb 0870 national rate,1,24,122,3,7,0,0,0,3,hot live fantasies 08707509020 20p per min ntt ltd po box 1327 croydon cr9 5wb 0870 national rate
1503,ham,dawhats plan,0,5,26,0,0,0,0,0,2,dawhats plan
1504,ham,ill,0,8,31,0,0,0,0,0,3,ill
1505,ham,oh god almost home,0,6,26,0,0,0,0,0,1,oh god almost home
1506,ham,total video converter free download type google search,0,10,64,0,0,0,1,0,2,total video converter free download type google search
1507,spam,thanks vote sing along stars karaoke mobile free link reply sing,1,24,121,0,2,0,1,0,10,thanks vote sing along stars karaoke mobile free link reply sing
1508,ham,wen lovable bcums angry wid dnt take seriously coz angry childish and true way showing deep affection care and luv kettoda manda n day the,0,34,179,0,0,1,0,0,6,wen lovable bcums angry wid dnt take seriously coz angry childish and true way showing deep affection care and luv kettoda manda n day the
1509,ham,sounds like something someone testing would sayy,0,9,56,0,0,0,0,0,2,sounds like something someone testing would sayy
1510,ham,love someone make love much love much want loved anyone except gud nit,0,33,148,0,0,0,0,0,11,love someone make love much love much want loved anyone except gud nit
1511,ham,peteis phone still jenny college leannewhat,0,16,90,0,0,0,0,0,8,peteis phone still jenny college leanne what
1512,ham,oops sorry check mind p king tomo half eight station would,0,22,110,0,0,0,0,0,10,oops sorry check mind p king tomo half eight station would
1513,ham,hey sweet wondering moment might come want send file someone wont yahoo connection sucks remember set page download format disc could tell know way download big files download stuff directly internet help would great prey teasing kiss,0,95,458,0,2,0,0,0,47,hey sweet wondering moment might come want send file someone wont yahoo connection sucks remember set page download format disc could tell know way download big files download stuff directly internet help would great prey teasing kiss
1514,ham,hows champ leaving glasgow,0,6,36,0,0,1,0,0,2,hows champ leaving glasgow
1515,ham,kall bestcongrats,0,3,28,0,0,0,0,0,1,kall best congrats
1516,ham,wonder youll,0,7,33,0,1,0,0,0,3,wonder youll
1517,ham,need come home give good lovin,0,11,51,0,1,0,0,0,4,need come home give good lovin
1518,spam,brand new mobile mus serv live free mus player arrive shortly install phone browse content top artists,1,28,157,0,0,0,1,0,8,brand new mobile mus serv live free mus player arrive shortly install phone browse content top artists
1519,ham,shall ask one thing mistake,0,10,45,0,0,0,0,0,3,shall ask one thing mistake
1520,ham,check wid corect speling ie sarcasm,0,6,37,0,0,0,0,0,0,check wid corect speling ie sarcasm
