,label,text,target,word_count,char_count,numerics,upper,bangs,flag_words,links,stp_wrd_cnt,text_corr
2685,ham,yupz ive oredi booked slots weekends liao,0,10,54,1,0,0,0,0,1,yupz ive oredi booked slots weekends liao
2686,spam,urgent trying contact todays draw shows 800 prize guaranteed 09050003091 land line claim c52 valid 12hrs,1,28,157,1,4,1,2,0,9,urgent trying contact todays draw shows 800 prize guaranteed 09050003091 land line claim c52 valid 12hrs
2687,ham,are many modelsony er son also der luks good bt forgot modl,0,16,88,0,0,0,0,0,2,are many models ony er son also der luks good bt forgot modl
2688,ham,okie,0,1,4,0,0,0,0,0,0,okie
2689,ham,yes know cheesy songs frosty snowman,0,11,54,0,1,0,0,0,3,yes know cheesy songs frosty snowman
2690,ham,ya vikky vl c witin mins il reply,0,13,56,0,0,0,0,0,1,ya vikky vl c witin mins il reply
2691,spam,sports fans latest sports news str ur mobile 1 wk free plus free tone sport 8007 wwwgetzedcouk 0870141701216 norm 4txt120p,1,29,153,3,6,0,2,2,3,sports fans latest sports news str ur mobile 1 wk free plus free tone sport 8007 wwwgetzedcouk 08 70 14 17 01 2 16 norm 4tx t12 0p
2692,ham,hey tmr meet bugis 930,0,7,27,1,0,0,0,0,1,hey tmr meet bugis 930
2693,spam,urgent urgent 800 free flights europe give away b4 10th sept take friend free claim 09050000555 ba128nnfwfly150ppm,1,29,158,2,3,1,4,0,7,urgent urgent 800 free flights europe give away b4 10th sept take friend free claim 09 05 00 00 55 5 ba12 8n nfwfly 15 0ppm
2694,ham,n new shirts thing wear nudist themed mu,0,21,95,0,1,0,0,0,10,n new shirts thing wear nudist themed mu
2695,ham,hey sexy buns day word morning ym think,0,22,95,0,2,1,0,0,8,hey sexy buns day word morning ym think
2696,ham,whenever still hook,0,12,52,0,0,0,0,0,6,whenever still hook
2697,ham,nope going home pump petrol lor like going rain soon,0,16,80,1,0,0,0,0,3,nope going home pump petrol lor like going rain soon
2698,ham,use foreign stamps whatever send,0,13,63,0,0,0,0,0,5,use foreign stamps whatever send
2699,spam,88066 lost 12 help,1,5,24,1,3,0,0,0,0,88066 lost 12 help
2700,ham,oh baby house come new p tures facebook,0,15,73,0,0,0,0,0,6,oh baby house come new p tures facebook
2701,ham,feb love day send dis valued frnds evn 3 comes back ull gt married person luv ignore dis lose luv evr,0,40,165,2,5,1,0,0,5,feb love day send dis valued frnds evn 3 comes back ull gt married person luv ignore dis lose luv evr
2702,ham,hiya sorry didnt hav signal havent seen heard neither unusual ill put case sort hugs snogs,0,34,169,0,1,2,0,0,15,hiya sorry didnt hav signal havent seen heard neither unusual ill put case sort hugs snogs
2703,ham,omw back tampa west palm hear happened,0,11,57,0,0,0,0,0,4,omw back tampa west palm hear happened
2704,ham,yup already thanx printing and handing,0,11,56,1,0,0,0,0,3,yup already thanx printing and handing
2705,spam,freemsg fancy flirt reply date join uks fastest growing mobile dating serv msgs rcvd 25p optout stop 83021 reply date,1,29,156,0,2,1,1,0,6,freemsg fancy flirt reply date join uks fastest growing mobile dating serv msgs rcvd 25p optout stop 8 30 21 reply date
2706,ham,mean come chase stated watch many movies want,0,26,113,0,0,0,0,0,17,mean come chase stated watch many movies want
2707,ham,took tablets reaction morning,0,10,50,0,1,0,0,0,3,took tablets reaction morning
2708,spam,great new offer double mins double best orange tariffs latest camera phones free mobileupd8 free 08000839402 2stoptxt tcs,1,29,160,2,6,2,2,0,3,great new offer double mins double best orange tariffs latest camera phones free mobileupd8 free 08000839402 2stoptxt tcs
2709,ham,nah perpetual dd,0,5,23,0,1,0,0,0,1,nah perpetual dd
2710,ham,sorry de went shop,0,6,24,0,0,0,0,0,2,sorry de went shop
2711,spam,hope enjoyed new content stop 61610 unsubscribe help08712400602450p provided tones2youcouk,1,16,118,1,0,0,0,2,5,hope enjoyed new content stop 61610 unsubscribe help08712400602450p provided tones2youcouk
2712,ham,wen lovable bcums angry wid dnt take seriously coz angry childish and true way showing deep affection care and luv kettoda manda n day the,0,34,179,0,0,1,0,0,6,wen lovable bcums angry wid dnt take seriously coz angry childish and true way showing deep affection care and luv kettoda manda n day the
2713,ham,hey still want yogasana coz end cine bathe hav steam bath,0,23,101,0,0,0,0,0,10,hey still want yogasana coz end cine bathe hav steam bath
2714,ham,nope drivin neva develop the photos lei,0,10,54,0,1,0,0,0,1,nope drivin neva develop the photos lei
2715,ham,thinking going reg pract lessons flung advance haha wat time going,0,19,96,0,1,0,0,0,6,thinking going reg pract lessons flung advance haha wat time going
2716,ham,cool inches long hope like big,0,13,59,0,1,1,0,0,3,cool inches long hope like big
2717,ham,housemaid murderer coz man murdered th january publ holiday govtinstituitions closedincluding post off eunderstand,0,23,166,0,0,0,0,0,7,housemaid murderer coz man murdered th january publ holiday govtinstituitions closedincluding post off eunderstand
2718,ham,okie thanx,0,2,14,0,0,0,0,0,0,okie thanx
2719,spam,18 days euro2004 k koff kept informed latest news results daily unsubscribe send euro stop 83222,1,25,135,1,4,1,0,0,8,18 days euro2004 k koff kept informed latest news results daily unsubscribe send euro stop 83222
2720,ham,and buy juz buy lar,0,11,46,0,0,0,0,0,4,and buy juz buy lar
2721,ham,lor,0,2,9,0,0,0,0,0,0,lor
2722,ham,working techn al support vo process,0,6,46,0,0,0,0,0,0,working techn al support vo process
2723,ham,justbeen overa week since broke already brains going mush,0,16,84,0,0,1,0,0,6,just been overa week since broke already brains going mush
2724,ham,tunde wishing great day abiola,0,14,71,0,0,0,0,0,7,tunde wishing great day abiola
2725,ham,nope c,0,4,19,0,1,0,0,0,0,nope c
2726,ham,well med al missions nigeria,0,8,44,0,0,0,0,0,2,well med al missions nigeria
2727,ham,movies laptop,0,11,46,0,0,0,0,0,8,movies laptop
2728,ham,whatsup want sleep,0,7,35,0,0,0,0,0,1,whatsup want sleep
2729,spam,urgent please 09066612661 landline 5000 cash luxury canary islands holiday await collection tcs sae award 20m12aq 150ppm 16 “,1,24,151,1,2,0,2,0,3,urgent please 09066612661 landline 5000 cash luxury canary islands holiday await collection tcs sae award 20m 12aq 150ppm 16 “
2730,spam,urgent please 09066612661 landline complimentary lux costa del sol holiday 1000 cash await collection ppm 150 sae tcs james 28 eh74rr,1,27,165,2,3,1,3,0,4,urgent please 09066612661 landline complimentary lux costa del sol holiday 1000 cash await collection ppm 150 sae tcs james 28 eh7 4rr
2731,ham,havent lei next mon,0,6,28,0,1,0,0,0,0,havent lei next mon
2732,ham,mm feeling sleepy today shall dear,0,10,53,0,0,0,0,0,3,mm feeling sleepy today shall dear
2733,ham,dare stupid wont tell anything hear wont talk,0,17,82,0,1,0,0,0,5,dare stupid wont tell anything hear wont talk
2734,ham,noe ben going,0,7,25,0,0,0,0,0,2,noe ben going
2735,ham,mag meeting avo point,0,11,48,0,0,0,0,0,6,mag meeting avo point
2736,ham,meant middle left right,0,6,29,0,1,0,0,0,1,meant middle left right
2737,ham,really crashed cuddled sofa,0,8,41,0,1,0,0,0,3,really crashed cuddled sofa
2738,ham,hi chachi tried calling unable reach pl give missed cal tiz msg kanagu,0,24,99,0,0,0,0,0,5,hi chachi tried calling unable reach pl give missed cal tiz msg kanagu
2739,ham,sent pr es mean g,0,13,55,0,1,0,0,0,6,sent pr es mean g
2740,ham,much buzy,0,5,22,0,0,0,0,0,2,much buzy
2741,ham,nothing,0,2,15,0,0,0,0,0,0,nothing
2742,spam,know u know send chat 86688 lets find 150pmsg rcvd hgsuite3422landsroww1j6hl ldn 18 years,1,28,158,2,3,1,0,0,8,know u know send chat 86688 lets find 150pmsg rcvd hgsuite3422landsroww1j6hl ldn 18 years
2743,ham,working ringing thing whole houseful screaming brats pulling hair loving,0,25,119,0,0,1,0,0,9,working ringing thing whole houseful screaming brats pulling hair loving
2744,ham,family responding anything room went home diwali one called coming makes feel like died,0,32,154,0,0,0,0,0,15,family responding anything room went home diwali one called coming makes feel like died
2745,ham,t k t k t k babe,0,5,25,0,0,0,0,0,0,t k t k t k babe
2746,ham,are ü going todays meeting,0,6,28,1,1,0,0,0,0,are ü going todays meeting
2747,ham,k dahow many page want,0,6,29,0,1,0,0,0,1,k dahow many page want
2748,ham,ya nowonion roast,0,5,28,0,0,0,0,0,2,ya now onion roast
2749,ham,send number give reply tomorrow morning said like,0,18,89,0,0,0,0,0,9,send number give reply tomorrow morning said like
2750,ham,said problem let know,0,12,56,0,0,0,0,0,3,said problem let know
2751,ham,tell half hr b4 come need prepare,0,14,53,1,0,0,0,0,4,tell half hr b4 come need prepare
2752,ham,play w computer aiyah tok u lor,0,9,37,1,0,0,0,0,1,play w computer aiyah tok u lor
2753,ham,sat right okay thanks,0,5,26,0,0,0,0,0,0,sat right okay thanks
2754,ham,derp worse dude always wants party dude files complaint three drug abusers lives,0,26,129,0,0,0,0,0,12,derp worse dude always wants party dude files complaint three drug abusers lives
2755,ham,chinese food way fat youre paying lipo,0,15,69,0,1,0,0,0,5,chinese food way fat youre paying lipo
2756,ham,are outside already,0,4,21,0,0,0,0,0,0,are outside already
2757,ham,good trip watch remember back must decide easter,0,18,89,0,0,0,0,0,7,good trip watch remember back must decide easter
2758,ham,yo watching movie netflix,0,8,37,0,0,0,0,0,4,yo watching movie netflix
2759,ham,time prob 3,0,9,37,1,0,0,0,0,4,time prob 3
2760,ham,meh thgt clash really ah dun mind dun seen lost weight gee,0,20,102,0,1,0,0,0,6,meh thgt clash really ah dun mind dun seen lost weight gee
2761,ham,thnk wrong calling us,0,9,42,0,1,0,0,0,3,thnk wrong calling us
2762,ham,sure night menu know noon menu,0,15,63,0,2,0,0,0,5,sure night menu know noon menu
2763,ham,arr birthday today wish oscar,0,10,50,0,1,0,0,0,4,arr birthday today wish oscar
2764,ham,say slowly godi love amp need youclean heart bloodsend ten special people amp miracle tomorrow itplspls,0,29,163,0,10,0,0,0,5,say slowly godi love amp need youclean heart bloodsend ten special people amp miracle tomorrow itplspls
2765,ham,open rebtel firefox loads put plus sign user name place show two numbers lower number number p k number pin display okay,0,39,200,0,0,1,0,0,15,open rebtel firefox loads put plus sign user name place show two numbers lower number number p k number pin display okay
2766,ham,p king various points,0,9,41,0,0,0,0,0,4,p king various points
2767,spam,married local women looking discreet action 5 real matches instantly phone match 69969 msg cost 150p stop stop bcmsfwc1n3xx,1,27,155,3,2,1,0,0,4,married local women looking discreet action 5 real matches instantly phone match 6 99 69 msg cost 150p stop stop bcmsf wc1n 3xx
2768,ham,wow v v impressed funs shopping,0,7,38,0,0,1,0,0,0,wow v v impressed funs shopping
2769,ham,way home,0,8,26,0,1,0,0,0,4,way home
2770,spam,burger king wanna play footy top stadium burger king 1st sept large super cocacola walk winner,1,29,141,1,0,0,1,0,9,burger king wanna play footy top stadium burger king 1st sept large super coca cola walk winner
2771,ham,problem talk later,0,6,29,0,0,0,0,0,2,problem talk later
2772,ham,sis,0,4,16,0,0,0,0,0,0,sis
2773,ham,still customer place,0,4,23,0,0,0,0,0,1,still customer place
2774,spam,come takes little time child afraid dark become teenager wants stay night,1,27,124,0,0,0,0,0,14,come takes little time child afraid dark become teenager wants stay night
2775,ham,dude knw also teluguthts gudk gud nyt,0,8,46,0,0,0,0,0,0,dude knw also telugu thts gudk gud nyt
2776,ham,confirm eating esplanade,0,5,31,0,0,0,0,0,1,confirm eating esplanade
2777,ham,send id password,0,6,28,0,0,0,0,0,3,send id password
2778,ham,kind took garage centre part exhaust needs replacing part ordered and taking fixed tomo morning,0,22,118,0,0,0,0,0,6,kind took garage centre part exhaust needs replacing part ordered and taking fixed tomo morning
2779,spam,chance win 250 cash every wk action 80608 tscs wwwmovietriviatv custcare 08712405022 1x150pwk,1,19,123,0,2,0,2,0,3,chance win 250 cash every wk action 80608 tscs wwwmovietriviatv custcare 08712405022 1x150pwk
2780,ham,well might come,0,6,29,0,1,0,0,0,1,well might come
2781,ham,long quit like 5 minutes day,0,16,63,1,2,0,0,0,6,long quit like 5 minutes day
2782,ham,likely called mittelschmertz google paracetamol worry,0,18,106,0,0,0,0,0,6,likely called mittel schmertz google paracetamol worry
2783,ham,well right gonna check todays steam salespee want come,0,26,121,0,0,0,0,0,13,well right gonna check todays steam sales pee want come
2784,ham,arrived couple days lt3,0,9,44,0,0,0,0,0,3,arrived couple days lt3
2785,ham,k wat tht incident,0,5,22,0,1,0,0,0,1,k wat tht incident
2786,ham,yeah unlimited,0,4,22,0,0,0,0,0,1,yeah unlimited
2787,ham,cthen thk shd b enuff still got conclusion and contents pg and references ill b the contents pg and cover pg,0,23,116,0,0,0,0,0,2,cthen thk shd b enuff still got conclusion and contents pg and references ill b the contents pg and cover pg
2788,ham,forgot takes 3 years shower sorry atyour phone dead yet,0,15,78,1,0,0,0,0,4,forgot takes 3 years shower sorry at your phone dead yet
2789,ham,got wat buy tell us need come,0,15,57,0,1,0,0,0,5,got wat buy tell us need come
2790,ham,big god bring success,0,8,43,0,0,0,0,0,3,big god bring success
2791,spam,u’ve bin awarded 50 play instant cash 08715203028 claim every 9th player wins min 50500 optout 08718727870,1,21,126,3,1,0,1,0,1,u’ve bin awarded 50 play instant cash 08 71 52 03 02 8 claim every 9th player wins min 5 05 00 optout 08718727870
2792,ham,… are stayin extra week back next wed rugby weekend hi c soon,0,29,116,0,0,0,0,0,12,… are stayin extra week back next wed rugby weekend hi c soon
2793,ham,well theres still bit left guys want tonight,0,12,57,0,0,0,0,0,4,well theres still bit left guys want tonight
2794,ham,campus library,0,9,45,0,0,0,0,0,5,campus library
2795,ham,affidavit says twiggs st division g courtroom lttimegt ill double check tomorrow,0,26,142,0,2,0,0,0,3,affidavit says twiggs st division g courtroom lttimegt ill double check tomorrow
2796,ham,creep,0,8,32,0,1,0,0,0,3,creep
2797,ham,tell friends plan valentines day lturlgt,0,13,69,0,0,0,0,0,6,tell friends plan valentines day lturlgt
2798,ham,ten billion calls texts help god,0,17,79,0,1,0,0,0,8,ten billion calls texts help god
2799,ham,purity friendship two smiling reading forwarded messageits smiling seeing name gud evng musthu,0,24,149,0,0,0,0,0,11,purity friendship two smiling reading forwarded messageits smiling seeing name gud evng musthu
2800,ham,ive told ive returned order,0,13,63,0,0,0,0,0,5,ive told ive returned order
2801,ham,housemaid murderer coz man murdered th january publ holiday govtinstituitions closedincluding post off,0,23,155,0,0,0,0,0,7,housemaid murderer coz man murdered th january publ holiday govtinstituitions closedincluding post off
2802,ham,depends going lor,0,6,29,0,0,0,0,0,2,depends going lor
2803,ham,smile right world wonder smiling think crazy keep away grins,0,30,145,0,0,0,0,0,17,smile right world wonder smiling think crazy keep away grins
2804,spam,freemsgfav xmas tonesreply real,1,4,33,0,2,1,0,0,0,freem sgfav xmas tones reply real
2805,ham,lil fever fine,0,4,22,0,0,0,0,0,1,lil fever fine
2806,ham,think still car,0,8,32,0,1,0,0,0,4,think still car
2807,ham,,0,3,10,0,0,0,0,0,1,
2808,spam,december mobile 11mths entitled update latest colour camera mobile free mobile update co free 08002986906,1,28,158,1,1,2,2,0,7,december mobile 11mths entitled update latest colour camera mobile free mobile update co free 08002986906
2809,ham,yes princess want catch big strong hands,0,12,61,0,1,1,0,0,4,yes princess want catch big strong hands
2810,ham,oh yeah forgot take shopping,0,13,57,1,2,0,0,0,4,oh yeah forgot take shopping
2811,ham,mm asked radio,0,9,36,0,0,0,0,0,5,mm asked radio
2812,ham,thinkin someone good drugs,0,10,52,0,0,0,0,0,5,thinkin someone good drugs
2813,ham,say slowly godi love amp need youclean heart bloodsend ten special people amp miracle tomorrow itplspls,0,29,163,0,10,0,0,0,5,say slowly godi love amp need youclean heart bloodsend ten special people amp miracle tomorrow itplspls
2814,ham,enjoy showers possessiveness poured ur loved ones bcoz world lies golden gift loved truly,0,27,133,0,0,0,0,0,12,enjoy showers possessiveness poured ur loved ones bcoz world lies golden gift loved truly
2815,ham,alright youre sure let know youre leaving,0,10,55,0,0,0,0,0,5,alright youre sure let know youre leaving
2816,ham,lasting much hours might lucky,0,12,57,1,0,0,0,0,3,lasting much hours might lucky
2817,ham,genius whats brother pls send number skype,0,13,68,0,0,0,0,0,4,genius whats brother pls send number skype
2818,spam,gr8 poly tones mobs direct 2u rply poly title 8007 eg poly breathe1 titles crazyin sleepingwith finest ymca getzedcouk pobox365o4w45wq 300p,1,25,160,2,9,0,0,2,2,gr8 poly tones mobs direct 2u rply poly title 8007 eg poly breathe1 titles crazy in sleeping with finest ymca get zed couk pobox 36 5o4 w45 wq 300p
2819,ham,thk em find wtc far weiyi goin rest dunno yet are ur goin dinner den might b able join,0,28,123,1,2,0,0,0,7,thk em find wtc far weiyi goin rest dunno yet are ur goin dinner den might b able join
2820,ham,forget owns whos private property good boy always passionate kiss,0,21,111,0,0,0,0,0,7,forget owns whos private property good boy always passionate kiss
2821,spam,interflora its late order interflora flowers christmas 0800 505060 place order midnight tomorrow,1,22,136,2,1,0,0,0,7,interflora its late order interflora flowers christmas 0800 50 50 60 place order midnight tomorrow
2822,ham,oh godtaken teethis paining,0,6,37,0,0,0,0,0,2,oh god taken teeth is paining
2823,spam,romcapspam everyone around responding well presence since warm outgoing bringing real breath sunshine,1,26,152,0,0,0,0,0,12,rom cap spam everyone around responding well presence since warm outgoing bringing real breath sunshine
2824,ham,ask darren and p k lor oso sian tmr haf meet lect,0,18,74,1,0,0,0,0,1,ask darren and p k lor oso sian tmr haf meet lect
2825,ham,need buy lunch eat maggi mee,0,11,47,0,1,0,0,0,2,need buy lunch eat maggi mee
2826,spam,congratulations thanks good friend 2000 xmas prize claim easy 08712103738 10p per minute btnationalrate,1,27,157,2,3,1,1,0,6,congratulations thanks good friend 2000 xmas prize claim easy 08 71 21 03 73 8 10p per minute btnationalrate
2827,ham,lor,0,2,9,0,0,0,0,0,0,lor
2828,ham,oh right ill make sure loads work day got really nasty cough today dry and shot really help,0,33,149,0,0,2,0,0,12,oh right ill make sure loads work day got really nasty cough today dry and shot really help
2829,ham,wifehow knew time murder exactly,0,8,44,0,0,0,0,0,3,wifehow knew time murder exactly
2830,spam,send logo ur lover names joined heart love name1 name2 mobno eg love adam eve 07123456789 87077 yahoo pobox36504w45wq txtno ads 150p,1,32,160,5,7,1,0,0,5,send logo ur lover names joined heart love name1 name2 mobno eg love adam eve 07123456789 87077 yahoo pobox36504w45wq txtno ads 150p
2831,ham,howz persons story,0,4,23,0,0,0,0,0,1,howz persons story
2832,ham,thanx sending home,0,5,26,1,0,0,0,0,1,thanx sending home
2833,ham,normally hot mail com,0,7,35,0,0,1,0,0,1,normally hot mail com
2834,spam,youve tkts euro2004 cup final 800 cash collect 09058099801 b4190604 pobox 7876150ppm,1,18,110,1,6,0,2,0,5,youve tkts euro2004 cup final 800 cash collect 09058099801 b4190604 pobox 7876150ppm
2835,ham,s k still shopping,0,6,29,0,1,0,0,0,1,s k still shopping
2836,ham,ya well fine bbdpooja full pimpleseven become quite blackand rite cold wearing sweatter,0,21,131,0,0,0,0,0,7,ya well fine bbd pooj a full pimples even become quite black and rite cold wearing sweatter
2837,ham,n en ehow working,0,4,28,0,0,0,0,0,2,n en ehow working
2838,ham,1s reach home,0,5,23,0,0,0,0,0,0,1s reach home
2839,ham,trying find chinese food place around,0,10,52,0,0,0,0,0,3,trying find chinese food place around
2840,ham,easy mate guess qu k drink bit ambitious,0,10,53,0,0,0,0,0,2,easy mate guess qu k drink bit ambitious
2841,ham,babe miiiiiiissssssssss need crave geeee sad without babe love,0,29,131,0,5,10,0,0,6,babe miiii iiiss ssssss ss need crave geeee sad without babe love
2842,ham,thanx,0,2,11,0,0,0,0,0,0,thanx
2843,ham,aathiwhere dear,0,4,27,0,0,0,0,0,2,aathiwhere dear
2844,ham,tunji hows queen wishing great day abiola,0,17,88,0,0,0,0,0,8,tunji hows queen wishing great day abiola
2845,ham,today iz yellow rose day love frndship give 1 misscall amp send frndz amp many miss calls 6missed marry lover,0,36,166,1,1,0,0,0,5,today iz yellow rose day love frndship give 1 missc all amp send frndz amp many miss calls 6missed marry lover
2846,ham,class hours sorry,0,10,42,0,0,0,0,0,6,class hours sorry
2847,ham,wat time finish lect today,0,7,32,0,0,0,0,0,0,wat time finish lect today
2848,spam,freemessage jamsterget crazy frog sound poly mad1 real mad2 88888 6 crazy sounds 3 gbpweek 16only tcs apply,1,27,157,2,2,4,0,0,5,free message jamster get crazy frog sound poly mad1 real mad2 88888 6 crazy sounds 3 gbp week 16only tcs apply
2849,ham,sad story man last week bday wife didnt wish parents forgot and kids went work even colleagues wish entered cabin pa said happy bday boss felt special askd lunch lunch invited apartment went said mind bedroom minute sed sexy mood came 5 minuts latr wid caken wife parents kidz friends and colleagues screaming surprise waiting sofa naked,0,125,588,2,10,5,0,0,32,sad story man last week bday wife didnt wish parents forgot and kids went work even colleagues wish entered cabin pa said happy bday boss felt special askd lunch lunch invited apartment went said mind bedroom minute sed sexy mood came 5 minuts latr wid caken wife parents kidz friends and colleagues screaming surprise waiting sofa naked
2850,spam,chance reality fantasy show 08707509020 20p per min ntt ltd po box 1327 croydon cr9 5wb 0870 national rate,1,32,151,3,13,0,0,0,3,chance reality fantasy show 08707509020 20p per min ntt ltd po box 1327 croydon cr9 5wb 0870 national rate
2851,ham,shes fine good hear dear happy new year oh,0,16,74,0,0,0,0,0,5,shes fine good hear dear happy new year oh
2852,ham,going wipro interview today,0,7,39,0,0,0,0,0,2,going wipro interview today
2853,ham,tall princess,0,5,26,0,0,0,0,0,3,tall princess
2854,ham,doubt could handle 5 times per night case,0,12,57,1,1,0,0,0,3,doubt could handle 5 times per night case
2855,ham,haha hope hear receipt sound gd luck,0,10,53,0,0,1,0,0,2,haha hope hear receipt sound gd luck
2856,ham,gonna death gonna leave note says robs fault avenge,0,20,94,0,0,0,0,0,7,gonna death gonna leave note says robs fault avenge
2857,ham,japanese proverb one none itu must indian version one let none itleave finally kerala version one stop none make strike,0,61,276,0,4,2,0,0,17,japanese proverb one none itu must indian version one let none itleave finally kerala version one stop none make strike
2858,ham,today workin free oso gee thgt workin frens shop,0,18,82,0,0,0,1,0,4,today workin free oso gee thgt workin frens shop
2859,ham,life face cho es toss coin becoz settle question coin air know heart hoping gudni8,0,33,160,0,1,0,0,0,14,life face cho es toss coin becoz settle question coin air know heart hoping gudni 8
2860,ham,know god created gap fingers one made comes amp fills gaps holding hand love,0,29,151,0,1,1,0,0,12,know god created gap fingers one made comes amp fills gaps holding hand love
2861,ham,want kiss feel next,0,16,60,0,1,0,0,0,11,want kiss feel next
2862,ham,happy saying,0,12,51,0,1,0,0,0,9,happy saying
2863,spam,adult 18 content video shortly,1,10,52,1,0,0,0,0,4,adult 18 content video shortly
2864,ham,would b lovely are sure think wot want drinkin dancin eatin cinema wot,0,30,138,0,0,1,0,0,6,would b lovely are sure think wot want drinkin dancin eatin cinema wot
2865,ham,saying havent expl itly told nora know someone probably gonna bother,0,19,104,0,1,0,0,0,6,saying havent expl itly told nora know someone probably gonna bother
2866,ham,says hi ass back south tampa preferably kegger,0,16,75,0,0,0,0,0,6,says hi ass back south tampa preferably kegger
2867,ham,smith waste dai wanna gayle,0,5,29,0,0,0,0,0,0,smith waste dai wanna gayle
2868,ham,mum ive sent many many messages since got want know actually getting enjoy rest day,0,29,142,0,1,0,0,0,10,mum ive sent many many messages since got want know actually getting enjoy rest day
2869,ham,aight tomorrow around,0,8,40,0,0,0,0,0,2,aight tomorrow around
2870,ham,housemaid murderer coz man murdered th january publ holiday govtinstituitions closedincluding post off eunderstand,0,23,166,0,0,0,0,0,7,housemaid murderer coz man murdered th january publ holiday govtinstituitions closedincluding post off eunderstand
2871,spam,chance reality fantasy show 08707509020 20p per min ntt ltd po box 1327 croydon cr9 5wb 0870 national rate,1,32,152,3,13,0,0,0,3,chance reality fantasy show 08707509020 20p per min ntt ltd po box 1327 croydon cr9 5wb 0870 national rate
2872,ham,actually first time went bed long spoke woke 7 night,0,30,130,0,2,0,0,0,15,actually first time went bed long spoke woke 7 night
2873,ham,,0,4,15,0,0,1,0,0,1,
2874,ham,understand message,0,5,31,0,1,0,0,0,1,understand message
2875,ham,crucify c told earlier,0,11,52,0,0,0,0,0,5,crucify c told earlier
2876,ham,idk keep saying youre since moved keep butting heads freedom vs responsibility tired much shit deal barely keeping together gets added,0,43,234,0,1,0,0,0,16,idk keep saying youre since moved keep butting heads freedom vs responsibility tired much shit deal barely keeping together gets added
2877,ham,fuck cedar key fuck come anyway tho,0,10,50,0,0,0,0,0,3,fuck cedar key fuck come anyway tho
2878,ham,twenty past five said train durham already coz reserved seat,0,22,103,0,0,0,0,0,12,twenty past five said train durham already coz reserved seat
