,label,text,target,word_count,char_count,numerics,upper,bangs,flag_words,links,stp_wrd_cnt,text_corr
4070,ham,hope youre much fun without tomorrow love jess x,0,15,75,0,0,2,0,0,3,hope youre much fun without tomorrow love jess x
4071,ham,wont disturb one know avoiding burden,0,20,84,0,2,0,0,0,9,wont disturb one know avoiding burden
4072,ham,ive reached home and bathe liao,0,12,56,0,1,0,0,0,3,ive reached home and bathe liao
4073,spam,loans purpose even bad credit tenants welcome noworriesloanscom 08717111821,1,16,106,1,0,1,0,2,6,loans purpose even bad credit tenants welcome no worrie sloans com 08 71 71 11 82 1
4074,ham,actual exam harder nbme,0,7,36,0,1,0,0,0,2,actual exam harder nbme
4075,ham,lot s kness thing going round take easy hope feel better soon lol,0,17,84,0,1,0,0,0,3,lot s kness thing going round take easy hope feel better soon lol
4076,ham,god p ked flower dippeditinadew lovingly touched itwh hturnedinto gifted tomeandsaidthis friend 4u,0,19,128,0,3,0,0,0,6,god p ked flower dippeditinadew lovingly touched itwh hturnedinto gifted tomeandsaidthis friend 4u
4077,spam,87077 k k new season 2wks free goals news mobile ur club name 87077 eg villa 87077,1,25,114,2,2,1,1,0,6,87077 k k new season 2wks free goals news mobile ur club name 87077 eg villa 87077
4078,ham,hey sathya till dint meet even single time saw situation sathya,0,20,96,0,0,0,0,0,9,hey sathya till dint meet even single time saw situation sathya
4079,ham,gam gone outstanding innings,0,5,35,0,0,0,0,0,1,gam gone outstanding innings
4080,ham,played smash bros religiously,0,9,46,0,1,0,0,0,1,played smash bros religiously
4081,ham,sir good morning hope good weekend called let know able raise dad however said would make rest available mid feb amount still quite short hoping would help good day abiola,0,58,276,0,1,0,0,0,21,sir good morning hope good weekend called let know able raise dad however said would make rest available mid feb amount still quite short hoping would help good day abiola
4082,ham,hurry home soup done,0,5,25,0,1,1,0,0,1,hurry home soup done
4083,ham,check rooms befor activities,0,9,46,0,1,0,0,0,2,check rooms befor activities
4084,ham,good afternoon love good words ym tm smart move slave smiles drink coffee await,0,32,153,0,2,0,0,0,10,good afternoon love good words ym tm smart move slave smiles drink coffee await
4085,ham,quite bit ex better eat smth else ill feel guilty,0,16,74,0,1,0,0,0,3,quite bit ex better eat smth else ill feel guilty
4086,spam,orange brings ringtones time chart heroes free hit week ringtones p s wap stop receiving tips reply stop,1,29,154,0,1,1,1,0,9,orange brings ringtones time chart heroes free hit week ringtones p s wap stop receiving tips reply stop
4087,ham,lemme know youre,0,5,27,0,0,0,0,0,3,lemme know youre
4088,spam,private 2003 account statement 07973788240 shows 800 unredeemed points 08715203649 identifier code 40533 expires 311004,1,21,148,5,4,1,0,0,1,private 2003 account statement 07 97 37 88 24 0 shows 800 unredeemed points 08 71 52 03 64 9 identifier code 40533 expires 311004
4089,ham,needs stop going bed make fucking dealing,0,13,63,0,0,0,0,0,5,needs stop going bed make fucking dealing
4090,ham,love brother time talk english grins say hey muhommad penny says hello across sea,0,31,147,0,0,0,0,0,10,love brother time talk english grins say hey muhommad penny says hello across sea
4091,spam,tried reply sms video mobile 750 mins unlimited free camcorder reply 08000930705,1,27,135,2,2,0,1,0,9,tried reply sms video mobile 750 mins unlimited free camcorder reply 08000930705
4092,ham,hey doc pls want n shirt hubby n fiting ones budget k help pls load card abi hwkeep posted luv mj,0,36,154,1,2,0,0,0,9,hey doc pls want n shirt hubby n fiting ones budget k help pls load card abi hwkeep posted luv mj
4093,ham,remain unconvinced isnt elaborate test willpower,0,12,70,0,1,0,0,0,6,remain unconvinced isnt elaborate test will power
4094,ham,life nothing wen v everything life everything wen v miss something real value people wil realized absence gud mrng,0,29,159,0,0,0,0,0,7,life nothing wen v everything life everything wen v miss something real value people wil realized absence gud mrng
4095,ham,miss,0,6,24,0,1,1,0,0,2,miss
4096,ham,aint answerin phone actually pretty reasonable hour sleepy,0,16,85,0,1,0,0,0,6,aint answerin phone actually pretty reasonable hour sleepy
4097,ham,hey rite put »10 evey mnth,0,13,48,0,0,0,0,0,3,hey rite put » 10 evey mnth
4098,ham,going bed prin,0,7,26,0,0,0,0,0,4,going bed prin
4099,ham,think …thanks tomo,0,9,46,0,1,0,0,0,4,think …thanks tomo
4100,ham,dun drive sch,0,10,35,1,0,0,0,0,3,dun drive sch
4101,ham,home lei,0,6,24,0,1,0,0,0,3,home lei
4102,spam,gsoh good spam ladiesu could b male gigolo join uks fastest growing mens club reply oncall mjzgroup 087143423992stop reply stop msg150rcvd,1,26,166,1,4,0,0,0,4,gsoh good spam ladiesu could b male gigolo join uks fastest growing mens club reply onc all mjz group 08 71 43 42 39 92stop reply stop msg1 50r cvd
4103,ham,come home half hour,0,12,49,0,0,0,0,0,6,come home half hour
4104,spam,secret admirer looking make contact ufind rreveal thinks specialcall 09058094599,1,24,132,2,2,0,0,0,11,secret admirer looking make contact ufind rreveal thinks specialcall 09058094599
4105,ham,hav frnd name ashwini college,0,11,48,0,0,0,0,0,3,hav frnd name ashw ini college
4106,ham,jus finish lunch way home lor tot dun wan stay sch today,0,19,80,1,1,0,0,0,4,jus finish lunch way home lor tot dun wan stay sch today
4107,ham,k 2marrow coming class,0,8,39,0,1,0,0,0,4,k 2marrow coming class
4108,spam,hot live fantasies 08707500020 20p per min ntt ltd po box 1327 croydon cr9 5wb 0870 national rate,1,24,122,3,7,0,0,0,3,hot live fantasies 08 70 75 00 02 0 20p per min ntt ltd po box 1327 croydon cr9 5wb 0870 national rate
4109,ham,pls send address sir,0,6,29,0,0,0,0,0,2,pls send address sir
4110,ham,want l k pussy,0,7,32,0,1,0,0,0,2,want l k pussy
4111,ham,yo gonna still stock tomorrowtoday trying dubsack,0,14,75,0,0,0,0,0,5,yo gonna still stock tomorrow today trying dubsack
4112,spam,urgent mobile number awarded ukp2000 prize guaranteed 09061790125 landline claim 3030 valid 12hrs 150ppm,1,21,141,1,3,1,1,0,5,urgent mobile number awarded ukp 20 00 prize guaranteed 09 06 17 90 12 5 landline claim 3030 valid 12hrs 150ppm
4113,ham,ill prolly yeah,0,5,25,0,0,0,0,0,1,ill prolly yeah
4114,ham,thought could dinner ill treat seem,0,12,60,0,0,1,0,0,3,thought could dinner ill treat seem
4115,ham,stand away doesnt heart ache without wonder crave,0,37,154,0,0,0,0,0,18,stand away doesnt heart ache without wonder crave
4116,ham,sorry never hear unless book one kinda jokethet really looking skinny white girls one lineyou much camera something like theyre casting look,0,42,230,0,0,0,0,0,16,sorry never hear unless book one kinda joke thet really looking skinny white girls one line you much camera something like theyre casting look
4117,ham,doinghow,0,5,27,0,0,0,0,0,2,doinghow
4118,ham,sure thing big man hockey elections 6 shouldn‘t longer hour though,0,18,92,0,0,0,0,0,6,sure thing big man hockey elections 6 shouldn‘ t longer hour though
4119,ham,watch lor saw swatch one thk quite ard 116 need 2nd opinion leh,0,20,87,1,1,0,0,0,5,watch lor saw swatch one thk quite ard 1 16 need 2nd opinion leh
4120,ham,hiya like hlday p s looked horrible took mo hows camp amrca thing speak soon serena,0,23,116,0,0,1,0,0,6,hiya like hlday p s looked horrible took mo hows camp amrca thing speak soon serena
4121,ham,babe goes day miss already love loving kiss hope everything goes well,0,28,126,0,2,1,0,0,7,babe goes day miss already love loving kiss hope everything goes well
4122,ham,yunny goin late,0,6,28,0,0,0,0,0,2,yunny goin late
4123,ham,doc prescribed morphine cause pain meds arent enough waiting mom bring med k k fast gonna try later,0,32,160,0,0,0,0,0,13,doc prescribed morphine cause pain meds arent enough waiting mom bring med k k fast gonna try later
4124,ham,cool want kappa meet outside mu,0,14,60,0,1,0,0,0,6,cool want kappa meet outside mu
4125,ham,hey sexy buns told adore loverboy hope remember thank sister law meatballs grins love babe,0,32,153,0,3,1,0,0,8,hey sexy buns told adore loverboy hope remember thank sister law meatballs grins love babe
4126,ham,may b approve panalambut posts,0,9,55,0,0,0,0,0,4,may b approve panala mbut posts
4127,spam,spjanuary male sale hot gay chat cheaper 08709222922 national rate 15pmin cheap 78pmin peak stop texts 08712460324 10pmin,1,24,157,1,0,2,0,0,3,spjanuary male sale hot gay chat cheaper 08709222922 national rate 15pmin cheap 78pmin peak stop texts 08712460324 10pmin
4128,ham,sorry ill later,0,4,22,0,0,0,0,0,0,sorry ill later
4129,ham,thnk wrong calling us,0,9,42,0,1,0,0,0,3,thnk wrong calling us
4130,ham,workin job,0,8,36,0,0,0,0,0,2,workin job
4131,ham,youre done mean,0,8,34,0,1,0,0,0,4,youre done mean
4132,ham,luck love someone fortune love one loves miracle love person cant love anyone except gud nyt,0,32,155,0,2,0,0,0,9,luck love someone fortune love one loves miracle love person cant love anyone except gud nyt
4133,ham,hi baby ive got back work wanting allday hope didnt piss phone today give xxx,0,36,147,0,1,1,0,0,14,hi baby ive got back work wanting all day hope didnt piss phone today give xxx
4134,spam,freemsg todays day ready horny live town love sex fun games netcollex ltd 08700621170150p per msg reply stop end,1,30,152,0,1,2,1,0,7,freemsg todays day ready horny live town love sex fun games netcollex ltd 08700621170150p per msg reply stop end
4135,ham,yahoo boys bring perf legal,0,12,55,0,0,0,0,0,5,yahoo boys bring perf legal
4136,ham,need say anything know outsider,0,13,54,0,1,0,0,0,5,need say anything know outsider
4137,ham,ever one foot,0,7,34,0,0,0,0,0,3,ever one foot
4138,ham,got,0,5,22,0,0,0,0,0,1,got
4139,ham,good don‘t need receipts—well done … yes please tell what‘s number could ring,0,19,103,0,0,2,0,0,4,good don‘t need receipts —well done … yes please tell what‘s number could ring
4140,ham,ever green quote ever told jerry cartoon person irritates always one loves vry much fails express gud nyt,0,32,159,0,1,3,0,0,4,ever green quote ever told jerry cartoon person irritates always one loves vry much fails express gud nyt
4141,ham,leave with lar wan carry meh heavy the num 98321561 familiar,0,19,87,1,1,0,0,0,5,leave with lar wan carry meh heavy the num 98 32 15 61 familiar
4142,ham,beautiful truth expression face could seen everyone depression heart could understood loved ones gud ni8,0,27,153,0,0,0,0,0,8,beautiful truth expression face could seen everyone depression heart could understood loved ones gud ni8
4143,ham,infact happy new year seeing,0,14,67,0,0,0,0,0,8,infact happy new year seeing
4144,spam,simpsons movie released july 2007 name band died start film agreen day bblue day cred day send b c,1,30,146,1,3,0,0,0,8,simpsons movie released july 2007 name band died start film agreen day bblue day cred day send b c
4145,ham,thats shame maybe cld meet hrs tomo,0,10,48,0,0,1,0,0,3,thats shame maybe cld meet hrs tomo
4146,ham,lol would despite cramps like girl,0,12,57,0,2,0,0,0,4,lol would despite cramps like girl
4147,ham,cant wait cornwall hope tonight isnt bad well its rock night shite anyway im going kip good night speak soon,0,32,157,0,1,0,0,0,11,cant wait cornwall hope tonight isnt bad well its rock night shite anyway im going kip good night speak soon
4148,ham,pls help tell sura expecting battery hont pls send message download movies thanks,0,27,139,0,0,0,0,0,12,pls help tell sura expecting battery hont pls send message download movies thanks
4149,spam,please amanda regard renewing upgrading current tmobile handset free charge offer ends today tel 0845 021 3680 subject ts cs,1,28,160,3,0,0,1,0,7,please amanda regard renewing upgrading current tmobile handset free charge offer ends today tel 0845 021 36 80 subject ts cs
4150,ham,havent found way another app phone eh net cafe take job geeee need babe crave,0,37,158,0,2,0,0,0,12,havent found way another app phone eh net cafe take job geeee need babe crave
4151,ham,work mon thurs sat cant leh booked liao day free,0,19,90,0,1,0,1,0,6,work mon thurs sat cant leh booked liao day free
4152,ham,comin fetch us oredi,0,6,28,0,1,0,0,0,1,comin fetch us oredi
4153,ham,whats nannys address,0,3,22,0,0,0,0,0,0,whats nannys address
4154,spam,urgent costa del sol holiday 5000 await collection 09050090044 toclaim sae tc pobox334 stockport sk38xh cost150pm max10mins,1,23,159,1,3,2,1,0,1,urgent costa del sol holiday 5000 await collection 09050090044 toclaim sae tc pobox334 stockport sk38xh cost150pm max10mins
4155,ham,haf eaten wat time wan come,0,10,38,1,0,0,0,0,1,haf eaten wat time wan come
4156,spam,want new video phone 750 anytime network mins half pr line rental free 3 months reply 08000930705 free delivery,1,26,144,3,0,0,2,0,5,want new video phone 750 anytime network mins half pr line rental free 3 months reply 08000930705 free delivery
4157,ham,yo chance friend mine wanted ask big order,0,21,92,0,0,0,0,0,11,yo chance friend mine wanted ask big order
4158,ham,single single answers fighting plus said broke didnt reply,0,16,84,0,0,0,0,0,6,single single answers fighting plus said broke didnt reply
4159,ham,certainly puts things perspective something like happens,0,11,74,0,0,0,0,0,3,certainly puts things perspective something like happens
4160,ham,got tv watch meh work today,0,10,40,1,1,0,0,0,1,got tv watch meh work today
4161,ham,felt sonot conveying reason ese,0,11,63,0,0,0,0,0,3,felt so not conveying reason ese
4162,spam,mobile 11 months are entitled update latest colour mobiles camera free mobile update co free 08002986030,1,29,154,2,3,1,2,0,8,mobile 11 months are entitled update latest colour mobiles camera free mobile update co free 08002986030
4163,ham,hows going got exciting karaoke type activities planned debating whether play football eve feeling lazy though,0,21,134,0,0,0,0,0,4,hows going got exciting karaoke type activities planned debating whether play football eve feeling lazy though
4164,ham,told coming wednesday,0,7,35,0,1,0,0,0,3,told coming wednesday
4165,ham,called mom instead fun,0,7,35,0,0,0,0,0,1,called mom instead fun
4166,spam,dear voucher holder claim weeks offer pc please httpwwwwtlpcouktext tscs apply,1,17,112,0,1,0,0,3,4,dear voucher holder claim weeks offer pc please http www wtlp couktext tscs apply
4167,ham,well desperate ill armand,0,10,54,0,0,0,0,0,4,well desperate ill armand
4168,ham,work right,0,7,27,0,0,0,0,0,3,work right
4169,spam,congrats nokia 3650 video camera phone 09066382422 calls cost 150ppm ave 3mins vary mobiles 16 close 300603 post bcm4284 ldn wc1n3xx,1,26,157,3,2,1,0,0,3,congrats nokia 3650 video camera phone 09066382422 calls cost 150ppm ave 3mins vary mobiles 16 close 300603 post bcm4284 ldn wc1n3xx
4170,ham,havent heard anything hes answering texts guessing flaked said jb fantast,0,20,111,0,0,0,0,0,7,havent heard anything hes answering texts guessing flaked said jb fantast
4171,ham,mmmmmm love youso much ahmad cant wait year begin every second takes closer side happy new year love,0,32,157,0,2,2,0,0,10,mmmmmm love you so much ahmad cant wait year begin every second takes closer side happy new year love
4172,ham,pls whats full name jokes school cos fees university florida seem actually k pls holla back,0,24,124,0,0,0,0,0,6,pls whats full name jokes school cos fees university florida seem actually k pls holla back
4173,ham,sorry ill later,0,4,22,0,0,0,0,0,0,sorry ill later
4174,ham,said ive got wisdom teeth hidden inside and mayb need remove,0,15,77,1,0,0,0,0,1,said ive got wisdom teeth hidden inside and mayb need remove
4175,ham,pls pls drink plenty plenty water,0,7,37,0,0,0,0,0,0,pls pls drink plenty plenty water
4176,ham,hows queen going royal wedding,0,14,71,0,0,0,0,0,6,hows queen going royal wedding
4177,ham,hes lag thats sad part keep touch thanks skype,0,16,74,0,0,0,0,0,7,hes lag thats sad part keep touch thanks skype
4178,ham,lor tog lor,0,7,28,0,0,0,0,0,2,lor tog lor
4179,ham,two teams waiting players,0,6,34,0,0,0,0,0,2,two teams waiting players
4180,ham,send copy the report,0,9,34,0,0,0,0,0,3,send copy the report
4181,ham,swhrt deyhope tot 2daylove and misstake care,0,13,67,0,0,0,0,0,2,swhrt dey hope tot 2day love and misstake care
4182,ham,the already planned wil p k,0,9,41,0,1,0,0,0,1,the already planned wil p k
4183,spam,urgent please 0906346330 abta complimentary spanish holiday 10000 cash await collection sae tcs box 47 po19 2ez 150ppm 18,1,23,143,1,5,1,2,0,1,urgent please 09 06 34 63 30 abta complimentary spanish holiday 10000 cash await collection sae tcs box 47 po19 2ez 150ppm 18
4184,ham,sorry ill later meeting,0,6,33,0,0,0,0,0,1,sorry ill later meeting
4185,ham,really need shit tomorrow know wont awake like 6,0,17,83,1,2,0,0,0,7,really need shit tomorrow know wont awake like 6
4186,ham,good registered vote,0,7,38,0,0,0,0,0,2,good registered vote
4187,ham,hmm ill stay like hour cos eye really sore,0,14,61,0,0,1,0,0,4,hmm ill stay like hour cos eye really sore
4188,ham,dear got bus directly cal ut,0,6,32,0,0,0,0,0,1,dear got bus directly cal ut
4189,ham,mm umma ask vava also come tell play later together,0,13,62,0,0,0,0,0,3,mm umma ask vava also come tell play later together
4190,ham,well general pr oz let know ifwhenhow much want,0,15,79,0,0,0,0,0,4,well general pr oz let know if when how much want
4191,ham,sorry ill later,0,4,22,0,0,0,0,0,0,sorry ill later
4192,ham,moment dayhas valuemorning brings hopeafternoon brings faithevening brings luvnight brings restwish find todaygood morning,0,22,158,0,0,0,0,0,6,moment dayh as value morning brings hope afternoon brings faith evening brings luv night brings rest wish find today good morning
4193,ham,w jetton ave forgot,0,8,37,0,0,0,0,0,2,w jetton ave forgot
4194,ham,coming home,0,5,23,0,0,0,0,0,0,coming home
4195,ham,use foreign stamps country,0,8,43,0,0,0,0,0,3,use foreign stamps country
4196,spam,double mins txts 6months free bluetooth orange available sony nokia motorola phones mobileupd8 08000839402 call2optoutn9dx,1,22,149,2,1,0,1,0,5,double mins txts 6months free bluetooth orange available sony nokia motorola phones mobileupd8 08000839402 call2optoutn9dx
4197,ham,sorry lot friendofafriend stuff talk actual guy wants buy,0,21,108,0,0,0,0,0,11,sorry lot friend of afriend stuff talk actual guy wants buy
4198,spam,free 1st week no1 nokia tone ur mob every week nokia 8007 txting tell mates wwwgetzedcouk pobox 36504 w45wq norm150ptone 16,1,29,158,3,3,1,1,2,4,free 1st week no1 nokia tone ur mob every week nokia 8007 txting tell mates wwwgetzedcouk pobox 36504 w45wq norm150ptone 16
4199,spam,want funk fone weekly new tone reply tones2u wwwringtonescouk original and best tones 3gbp network operator rates apply,1,27,155,1,2,0,0,2,6,want funk fone weekly new tone reply tones2u wwwringtonescouk original and best tones 3gbp network operator rates apply
4200,spam,cmon babe make horny turn fantasy babe hot st ky need replies cost 150 cancel send stop,1,30,147,1,1,1,0,0,7,cmon babe make horny turn fantasy babe hot st ky need replies cost 150 cancel send stop
4201,ham,come tomorrow di,0,5,23,0,1,0,0,0,1,come tomorrow di
4202,ham,wylie update weed dealer carlos went freedom class lunsford,0,15,81,0,0,0,0,0,6,wylie update weed dealer carlos went freedom class lunsford
4203,ham,happy baby alright take job hope fine send kiss make smile across sea kiss kiss,0,35,154,0,2,0,0,0,11,happy baby alright take job hope fine send kiss make smile across sea kiss kiss
4204,ham,c movie juz last minute decision mah juz watch lar tot interested,0,18,84,1,1,0,0,0,4,c movie juz last minute decision mah juz watch lar tot interested
4205,ham,enjoying semester take care brother,0,9,54,0,0,0,0,0,3,enjoying semester take care brother
4206,spam,important information orange user 0796xxxxxx today lucky day2 find log onto httpwwwurawinnercom theres fantast prizeawaiting,1,22,157,1,20,2,0,3,0,important information orange user 07 96xxx xxx today lucky day2 find log onto httpwwwurawinnercom theres fantast prizea waiting
4207,ham,door,0,5,22,0,0,0,0,0,2,door
4208,ham,lets use next week princess,0,7,34,0,0,0,0,0,1,lets use next week princess
4209,ham,home first lar wait lor put stuff first,0,17,68,1,1,0,0,0,4,home first lar wait lor put stuff first
4210,ham,want kfc tuesday buy meals gravy mark,0,17,74,2,2,1,0,0,1,want kfc tuesday buy meals gravy mark
4211,ham,dahe stupid daalways sending like thisdon believe messagepandy mental,0,16,102,0,0,0,0,0,6,dahe stupid daalways sending like thisd on believe message pandy mental
4212,ham,oi gonna ring,0,5,22,0,0,0,0,0,2,oi gonna ring
4213,spam,missed alert numbers called left message 07008009200,1,11,72,1,0,0,0,0,2,missed alert numbers called left message 07 00 80 09 20 0
4214,ham,attended nothing,0,6,32,0,1,0,0,0,2,attended nothing
4215,ham,ard 530 like dat lor juz meet mrt station dun haf come,0,18,76,1,0,0,0,0,3,ard 530 like dat lor juz meet mrt station dun haf come
4216,ham,dear sleeping p,0,6,26,0,1,0,0,0,2,dear sleeping p
4217,ham,er mw filled tuth aight,0,7,29,0,0,0,0,0,1,er mw filled tuth aight
4218,ham,off around pm going hospital,0,11,52,1,0,0,0,0,3,off around pm going hospital
4219,ham,actually waiting weeks start putting ad,0,11,60,1,0,0,0,0,3,actually waiting weeks start putting ad
4220,ham,anything lor lor,0,10,44,0,0,0,0,0,5,anything lor lor
4221,ham,free sat rite wan watch infernal affairs with n darren and mayb xy,0,18,77,1,2,0,1,0,2,free sat rite wan watch infernal affairs with n darren and mayb xy
4222,ham,plz note anyone calling mobile co amp asks type disconnect callcoz iz attempt terrorist make use sim card itz confirmd nokia and motorola and verified cnn ibn,0,55,263,0,2,0,0,0,18,plz note anyone calling mobile co amp asks type disconnect callcoz iz attempt terrorist make use sim card itz confirmd nokia and motorola and verified cnn ibn
4223,ham,yo around friend mines lookin p k later tonight,0,13,65,0,1,0,0,0,4,yo around friend mines lookin p k later tonight
4224,ham,stupid auto correct phone,0,6,31,0,0,0,0,0,2,stupid auto correct phone
4225,ham,double ev tion week spiral m hael good riddance,0,13,73,0,0,1,0,0,4,double ev tion week spiral m hael good riddance
4226,ham,world suffers lot violence bad people silence good people gud night,0,23,129,0,0,1,0,0,9,world suffers lot violence bad people silence good people gud night
4227,ham,thats cool either raglan rd edward rd behind cr ket ground gimme ring closeby tuesday,0,25,131,0,0,0,0,0,6,thats cool either raglan rd edward rd behind cr ket ground gimme ring closeby tuesday
4228,ham,buy one egg daplease,0,6,31,0,0,0,0,0,2,buy one egg daple ase
4229,ham,started skye,0,5,24,0,0,0,0,0,2,started skye
4230,ham,bookedthe hut also time way,0,15,71,0,0,0,0,0,6,booked the hut also time way
4231,ham,several sir,0,5,23,0,0,0,0,0,2,several sir
4232,ham,really pig leh sleep much dad wake 10 smth eat lunch today,0,19,79,2,1,0,0,0,4,really pig leh sleep much dad wake 10 smth eat lunch today
4233,ham,home please,0,5,24,0,0,0,0,0,1,home please
4234,ham,love hope anything drast dare sell pc phone,0,20,97,0,1,0,0,0,7,love hope anything drast dare sell pc phone
4235,ham,reached home tired come tomorro,0,17,71,0,2,0,0,0,5,reached home tired come tomorro
4236,spam,freemsg records ind ate may entitled 3750 pounds accident claim free reply yes msg opt stop,1,31,157,1,3,0,2,0,11,freemsg records ind ate may entitled 37 50 pounds accident claim free reply yes msg opt stop
4237,spam,win 100 mus gift vouchers every week starting word draw 87066 tscs wwwidewcom skillgame 1winaweek age16 150ppermesssubscription,1,24,159,1,4,0,1,2,4,win 100 mus gift vouchers every week starting word draw 87066 tscs wwwidewcom skillgame 1winaweek age16 150ppermesssubscription
4238,ham,life style garments account please,0,6,38,0,0,0,0,0,1,life style garments account please
4239,ham,lol wtf random btw lunch break,0,9,44,0,0,0,0,0,3,lol wtf random btw lunch break
4240,ham,sez hows de arab boy hope are good give love evry1 love ya eshxxxxxxxxxxx,0,20,88,1,0,0,0,0,2,sez hows de arab boy hope are good give love evry1 love ya eshxx xxx xxx xxx
4241,ham,lay man let know missed thought great day send bimbo ugos numbers ill appreciate safe,0,32,155,0,2,1,0,0,12,lay man let know missed thought great day send bimbo ugos numbers ill appreciate safe
4242,ham,detroit home snow enjoy,0,7,36,0,0,0,0,0,1,detroit home snow enjoy
4243,spam,show colours euro 2004 241 offer england flag 3lions tone phone cl k following serv message info,1,25,135,1,0,4,0,0,5,show colours euro 2004 2 41 offer england flag 3lions tone phone cl k following serv message info
4244,ham,okie,0,1,7,0,0,0,0,0,0,okie
4245,ham,aight chillin friends room youre way,0,15,71,0,0,0,0,0,8,aight chillin friends room youre way
4246,ham,toshiba portege m100 gd,0,5,27,0,0,0,0,0,0,toshiba portege m1 00 gd
4247,ham,well welp sort semiobscure internet thing,0,9,49,0,0,0,0,0,3,well welp sort semi obscure internet thing
4248,spam,pass 69669 collect polyphon ringtones normal gprs charges apply enjoy tones,1,17,105,1,1,0,0,0,4,pass 69669 collect polyphon ringtones normal gprs charges apply enjoy tones
4249,spam,accordingly repeat word mobile phone send,1,14,74,0,1,0,0,0,5,accordingly repeat word mobile phone send
4250,ham,loosu hospital de let careless,0,9,46,0,0,0,0,0,2,loosu hospital de let careless
4251,ham,much eighth,0,5,23,0,0,0,0,0,2,much eighth
4252,ham,omg joanna freaking shes looked thru friends find photos shes asking stuff myspace havent even logged like year,0,37,183,0,1,0,0,0,16,omg joanna freaking shes looked thru friends find photos shes asking stuff myspace havent even logged like year
4253,ham,send birthdate month year tel ur life partners name method calculation reply must,0,22,118,0,3,0,0,0,6,send birthdate month year tel ur life partners name method calculation reply must
4254,ham,juz havent woke bit blur blur dad went liao cant cum oso,0,20,92,0,1,0,0,0,6,juz havent woke bit blur blur dad went liao cant cum oso
